{
  "receipt_id": "REC-000001",
  "receipt_type": "PUBLIC_RECORD_VERIFICATION_V1",
  "authority": false,
  "claim": "The FY2024 Budget requests $73.3 billion in gross discretionary appropriations for the Department of Housing and Urban Development.",
  "claim_hash": "sha256:5ece344efd4d5f5b83c53bfd0e03bd518694f8c4c5f5200b44913c14c2c23bfc",
  "source_uri": "https://crsreports.congress.gov/product/pdf/IF/IF12278",
  "timestamp_utc": "2026-06-02T23:30:00Z"
}
